{
  "schema_id": "urn:serenity:schema:evidence-catalog:1",
  "catalog_id": "evidence-catalog-free-v1",
  "created_at": "2026-08-17T00:00:00Z",
  "providers": [
    {"provider_id": "yfinance", "tier": "baseline", "capabilities": ["yfinance.market-data", "yfinance.financial-statements", "yfinance.valuation"], "source_kind": "library"},
    {"provider_id": "sec", "tier": "baseline", "capabilities": ["sec.identity", "sec.submissions", "sec.filings"], "source_kind": "regulator"},
    {"provider_id": "openfigi", "tier": "baseline", "capabilities": ["openfigi.security-identity"], "source_kind": "identifier-registry"},
    {"provider_id": "alfred-fred", "tier": "baseline", "capabilities": ["alfred-fred.macro-series", "alfred-fred.vintage-series"], "source_kind": "government-data"},
    {"provider_id": "ibd-rs-rating", "version": "0.3.0", "tier": "baseline", "capabilities": ["ibd-rs-rating.relative-strength-observation"], "source_kind": "library"},
    {"provider_id": "usaspending", "tier": "adaptive", "capabilities": ["usaspending.federal-awards", "usaspending.contract-obligations"], "source_kind": "government-data"},
    {"provider_id": "usitc", "tier": "adaptive", "capabilities": ["usitc.trade-data", "usitc.tariff-data"], "source_kind": "government-data"},
    {"provider_id": "eia", "tier": "adaptive", "capabilities": ["eia.energy-data"], "source_kind": "government-data"},
    {"provider_id": "bls", "tier": "adaptive", "capabilities": ["bls.labor-data", "bls.price-data"], "source_kind": "government-data"},
    {"provider_id": "bea", "tier": "adaptive", "capabilities": ["bea.national-accounts", "bea.industry-data"], "source_kind": "government-data"},
    {"provider_id": "cftc", "tier": "adaptive", "capabilities": ["cftc.commitments-of-traders"], "source_kind": "regulator"},
    {"provider_id": "federal-register", "tier": "adaptive", "capabilities": ["federal-register.rulemaking", "federal-register.notices"], "source_kind": "government-publication"},
    {"provider_id": "bis", "tier": "adaptive", "capabilities": ["bis.export-controls", "bis.entity-lists"], "source_kind": "regulator"},
    {"provider_id": "issuer-ir", "tier": "adaptive", "capabilities": ["issuer-ir.announcements", "issuer-ir.presentations"], "source_kind": "issuer"},
    {"provider_id": "sam", "tier": "optional", "capabilities": ["sam.procurement-opportunities"], "source_kind": "government-data"},
    {"provider_id": "uspto", "tier": "optional", "capabilities": ["uspto.patent-records"], "source_kind": "government-data"}
  ]
}
